{
  "$schema": "./.board-schema.json",
  "version": 1,
  "updated_at": "2026-05-13",
  "next_id": 60,
  "items": [
    {
      "id": "AJ-1",
      "slug": "agent",
      "type": "feature",
      "title": "@Agent decorator",
      "status": "done",
      "priority": "p0",
      "milestone": "v0.1",
      "labels": [
        "primitive",
        "v0.1"
      ],
      "owner": "jesus.cocano@gmail.com",
      "branch": "feature/agent",
      "pr": null,
      "spec": "specs/agent.md",
      "blocks": [
        "AJ-2",
        "AJ-3",
        "AJ-4",
        "AJ-5",
        "AJ-23",
        "AJ-24",
        "AJ-47",
        "AJ-48",
        "AJ-54",
        "AJ-55"
      ],
      "blocked_by": [
        "AJ-18",
        "AJ-19"
      ],
      "estimate": null,
      "created_at": "2026-05-12",
      "updated_at": "2026-05-12",
      "closed_at": "2026-05-12"
    },
    {
      "id": "AJ-2",
      "slug": "tool",
      "type": "feature",
      "title": "@Tool decorator + function-calling loop",
      "status": "done",
      "priority": "p0",
      "milestone": "v0.1",
      "labels": [
        "primitive",
        "v0.1"
      ],
      "owner": "jesus.cocano@gmail.com",
      "branch": "feature/tool",
      "pr": null,
      "spec": "specs/tool.md",
      "blocks": [
        "AJ-6",
        "AJ-7",
        "AJ-48",
        "AJ-54",
        "AJ-55"
      ],
      "blocked_by": [
        "AJ-1"
      ],
      "estimate": null,
      "created_at": "2026-05-12",
      "updated_at": "2026-05-12",
      "closed_at": "2026-05-12"
    },
    {
      "id": "AJ-3",
      "slug": "stream",
      "type": "feature",
      "title": "@Stream decorator (SSE on @Agent and @Workflow)",
      "status": "done",
      "priority": "p0",
      "milestone": "v0.1",
      "labels": [
        "primitive",
        "v0.1"
      ],
      "owner": "jesus.cocano@gmail.com",
      "branch": "feature/stream",
      "pr": "https://github.com/jcocano/Ajolopy/pull/15",
      "spec": "specs/stream.md",
      "blocks": [
        "AJ-48",
        "AJ-54"
      ],
      "blocked_by": [
        "AJ-1",
        "AJ-15"
      ],
      "estimate": null,
      "created_at": "2026-05-12",
      "updated_at": "2026-05-12",
      "closed_at": "2026-05-12"
    },
    {
      "id": "AJ-4",
      "slug": "eval",
      "type": "feature",
      "title": "@Eval decorator + regression detection",
      "status": "backlog",
      "priority": "p1",
      "milestone": "v0.1",
      "labels": [
        "primitive",
        "v0.1"
      ],
      "owner": null,
      "branch": null,
      "pr": null,
      "spec": null,
      "blocks": [
        "AJ-26",
        "AJ-27",
        "AJ-35",
        "AJ-48",
        "AJ-55"
      ],
      "blocked_by": [
        "AJ-1",
        "AJ-25"
      ],
      "estimate": null,
      "created_at": "2026-05-12",
      "updated_at": "2026-05-12",
      "closed_at": null
    },
    {
      "id": "AJ-5",
      "slug": "metric",
      "type": "feature",
      "title": "@Metric decorator (custom metrics on agents)",
      "status": "backlog",
      "priority": "p1",
      "milestone": "v0.1",
      "labels": [
        "primitive",
        "v0.1"
      ],
      "owner": null,
      "branch": null,
      "pr": null,
      "spec": null,
      "blocks": [],
      "blocked_by": [
        "AJ-1"
      ],
      "estimate": null,
      "created_at": "2026-05-12",
      "updated_at": "2026-05-12",
      "closed_at": null
    },
    {
      "id": "AJ-6",
      "slug": "workflow",
      "type": "feature",
      "title": "@Workflow decorator (multi-agent orchestration)",
      "status": "backlog",
      "priority": "p1",
      "milestone": "v0.1",
      "labels": [
        "primitive",
        "v0.1"
      ],
      "owner": null,
      "branch": null,
      "pr": null,
      "spec": null,
      "blocks": [
        "AJ-48",
        "AJ-55"
      ],
      "blocked_by": [
        "AJ-2",
        "AJ-18"
      ],
      "estimate": null,
      "created_at": "2026-05-12",
      "updated_at": "2026-05-12",
      "closed_at": null
    },
    {
      "id": "AJ-7",
      "slug": "mcp",
      "type": "feature",
      "title": "@MCP decorator (MCP server publish + consume)",
      "status": "backlog",
      "priority": "p1",
      "milestone": "v0.1",
      "labels": [
        "primitive",
        "v0.1"
      ],
      "owner": null,
      "branch": null,
      "pr": null,
      "spec": null,
      "blocks": [
        "AJ-48",
        "AJ-55"
      ],
      "blocked_by": [
        "AJ-2"
      ],
      "estimate": null,
      "created_at": "2026-05-12",
      "updated_at": "2026-05-12",
      "closed_at": null
    },
    {
      "id": "AJ-8",
      "slug": "module",
      "type": "feature",
      "title": "@Module decorator (DI container root)",
      "status": "done",
      "priority": "p0",
      "milestone": "v0.1",
      "labels": [
        "primitive",
        "v0.1"
      ],
      "owner": "jesus.cocano@gmail.com",
      "branch": "feature/module",
      "pr": "https://github.com/jcocano/Ajolopy/pull/33",
      "spec": "specs/module.md",
      "blocks": [
        "AJ-9",
        "AJ-10"
      ],
      "blocked_by": [
        "AJ-11"
      ],
      "estimate": null,
      "created_at": "2026-05-12",
      "updated_at": "2026-05-13",
      "closed_at": "2026-05-13"
    },
    {
      "id": "AJ-9",
      "slug": "injectable",
      "type": "feature",
      "title": "@Injectable decorator (provider registration)",
      "status": "in_review",
      "priority": "p0",
      "milestone": "v0.1",
      "labels": [
        "primitive",
        "v0.1"
      ],
      "owner": "jesus.cocano@gmail.com",
      "branch": "feature/injectable",
      "pr": null,
      "spec": "specs/injectable.md",
      "blocks": [
        "AJ-10"
      ],
      "blocked_by": [
        "AJ-8",
        "AJ-11"
      ],
      "estimate": null,
      "created_at": "2026-05-12",
      "updated_at": "2026-05-13",
      "closed_at": null
    },
    {
      "id": "AJ-10",
      "slug": "controller",
      "type": "feature",
      "title": "@Controller decorator (HTTP route binding)",
      "status": "backlog",
      "priority": "p1",
      "milestone": "v0.1",
      "labels": [
        "primitive",
        "v0.1"
      ],
      "owner": null,
      "branch": null,
      "pr": null,
      "spec": null,
      "blocks": [
        "AJ-49"
      ],
      "blocked_by": [
        "AJ-8",
        "AJ-9",
        "AJ-15",
        "AJ-16"
      ],
      "estimate": null,
      "created_at": "2026-05-12",
      "updated_at": "2026-05-12",
      "closed_at": null
    },
    {
      "id": "AJ-11",
      "slug": "di-container",
      "type": "feature",
      "title": "DI Container core (type-hint resolution, scopes, forwardRef)",
      "status": "done",
      "priority": "p0",
      "milestone": "v0.1",
      "labels": [
        "foundation",
        "v0.1"
      ],
      "owner": "jesus.cocano@gmail.com",
      "branch": "feature/di-container",
      "pr": "https://github.com/jcocano/Ajolopy/pull/22",
      "spec": "specs/di-container.md",
      "blocks": [
        "AJ-8",
        "AJ-9",
        "AJ-13",
        "AJ-14",
        "AJ-46"
      ],
      "blocked_by": [],
      "estimate": null,
      "created_at": "2026-05-12",
      "updated_at": "2026-05-12",
      "closed_at": "2026-05-12"
    },
    {
      "id": "AJ-12",
      "slug": "config-service",
      "type": "feature",
      "title": "BaseConfig + ConfigService (Pydantic v2, .env loading, startup validation)",
      "status": "done",
      "priority": "p0",
      "milestone": "v0.1",
      "labels": [
        "foundation",
        "v0.1"
      ],
      "owner": "jesus.cocano@gmail.com",
      "branch": "feature/config-service",
      "pr": null,
      "spec": "specs/config-service.md",
      "blocks": [
        "AJ-14",
        "AJ-19",
        "AJ-20",
        "AJ-21",
        "AJ-29",
        "AJ-36",
        "AJ-40"
      ],
      "blocked_by": [],
      "estimate": null,
      "created_at": "2026-05-12",
      "updated_at": "2026-05-12",
      "closed_at": "2026-05-12"
    },
    {
      "id": "AJ-13",
      "slug": "lifecycle-hooks",
      "type": "feature",
      "title": "Lifecycle hooks (on_module_init, on_app_bootstrap, on_app_shutdown)",
      "status": "done",
      "priority": "p0",
      "milestone": "v0.1",
      "labels": [
        "foundation",
        "v0.1"
      ],
      "owner": "jesus.cocano@gmail.com",
      "branch": "feature/lifecycle-hooks",
      "pr": "https://github.com/jcocano/Ajolopy/pull/27",
      "spec": "specs/lifecycle-hooks.md",
      "blocks": [
        "AJ-14"
      ],
      "blocked_by": [
        "AJ-11"
      ],
      "estimate": null,
      "created_at": "2026-05-12",
      "updated_at": "2026-05-13",
      "closed_at": "2026-05-13"
    },
    {
      "id": "AJ-14",
      "slug": "factory-bootstrap",
      "type": "feature",
      "title": "AjolopyFactory.create() bootstrap (DI + config + lifecycle + HTTP)",
      "status": "backlog",
      "priority": "p0",
      "milestone": "v0.1",
      "labels": [
        "foundation",
        "v0.1"
      ],
      "owner": null,
      "branch": null,
      "pr": null,
      "spec": null,
      "blocks": [
        "AJ-28",
        "AJ-33",
        "AJ-46"
      ],
      "blocked_by": [
        "AJ-11",
        "AJ-12",
        "AJ-13",
        "AJ-15"
      ],
      "estimate": null,
      "created_at": "2026-05-12",
      "updated_at": "2026-05-12",
      "closed_at": null
    },
    {
      "id": "AJ-15",
      "slug": "http-layer",
      "type": "feature",
      "title": "HTTP layer over Starlette (ValidationPipe, ExceptionFilter, body/query/path params)",
      "status": "done",
      "priority": "p0",
      "milestone": "v0.1",
      "labels": [
        "foundation",
        "v0.1"
      ],
      "owner": "jesus.cocano@gmail.com",
      "branch": "feature/http-layer",
      "pr": "https://github.com/jcocano/Ajolopy/pull/13",
      "spec": "specs/http-layer.md",